{
  "id": "EVD-20260516-001",
  "timestamp": "2026-05-16T17:00:00Z",
  "author": "Antigravity",
  "stage": "implementation",
  "phase": "v3-hardening-phase-3",
  "status": "PASS",
  "summary": "Hardened all 7 JSON schemas with deep fields and validation.",
  "sourceFiles": [
    ".agents/config/schemas/evidence.schema.json",
    ".agents/config/schemas/review.schema.json"
  ],
  "commands": [
    "python3 -c 'import json; json.load(...)'"
  ],
  "validationResult": "PASS",
  "blockingDecision": "NONE"
}
